qid,passage,original,anon_sent,tech
"41","In addition, According to N Hakamies, “Although material and human resources are significant constraints on agencies, the main challenge is to tackle ideological, managerial and policy barriers, and those related to donor influence.” Finding funding for family planning services continues to prove difficult for NGOs, and as a result they often do not exist or cannot meet the need levels of their constituencies. Reproductive Health funding problems underscore a larger issue with a reliance on NGO services, as can often be seen in IDP situations. The ability to provide services is often reliant on funding from outside sources and its continuation is based not on the needs of those being served, but on what they can find funding to provide. Often an organization's decision to cease operations in a country has more to do with a lack of financial support than the successful completion of their programming. There are certainly other issues with over reliance on NGO services, such as the fact that their services often don't solve the underlying infrastructure issues that will reemerge once the NGO presence is reduced. Many NGOs do not remain in-country for the post-conflict period. In effect, services are provided and once the initial emergency is over, the NGOs are gone and those still displaced must find a health provider somewhere else. This affects a country's capacity to rebuild post-conflict as well as their ability to provide services while the rebuilding effort is underway. <span id='here'><strong><mark> <---- Original Sentence was here ----> </mark></strong></span> NGO involvement in IDP aid is a fact of life, however. The critical point is that the Ministry of Health must coordinate among those organizations. Much of the focus on healthcare provision during emergency and conflict situations revolves around the use of Mobile Health Units (MHUs). Mobile Health Units are, at their most basic, mobile service units that usually provide specific forms of both preventative and curative care. They are generally expensive, however, and the fact that they only provide services intermittently tends to affect when they are appropriate for use. According to Stephane du Mortier and Rudi Coninx, “In situations of armed conflict, the range of PHC services that can be provided is severely restricted. This means that, in any given situation, it is essential to select the priority services among the spectrum of PHC services”. MHUs are limited in the number of services they can provide and the frequency at which they are available to any one community. These considerations must be kept in mind when formulating a plan as to how to use MHUs in any conflict or emergency setting. Du Mortier and Coninx describe their use of MHUs with the International Committee of the Red Cross during the conflict in Columbia in 2005. In this case, the rebel forces refused to allow access to the Ministry of Health in the country to citizens in areas they held.","Another issue is the added levels of coordination that occur when working with multiple aid groups to ensure healthcare service coverage.","Another concern is - added levels of coordination that occur when working with multiple aid groups to ensure full service coverage.","LSB"
"q_1","My question dealt with the fact that it takes a certain amount of time for a bone that has a fracture to heal. I stated that the body needs a specific amount of time to transfer calcium from locations in the body to the fracture. I also mentioned that the cells that build up the various tissues found within the bone have to grow and divide and repeat this process until the fracture was knitted. I was concerned because this took time and that it was an actual physical process – there are no shortcuts. Also, I did not understand how a broken bone could be considered not real. Barbara assured me that fractures could heal “instantaneously” and that the body was not limited by time or resources since God was perfect and that matter was not real. I wanted to know how the healing process worked. Within the Church there are two types of healers. One is called a Practitioner and the other type is referred to as a Christian Science Nurse. A Practitioner begins by becoming a member of the Christian Science Church. A member does all the regular things, attends weekly Sunday services and on Wednesday nights twice a month, there are testimonials where members speak about their experiences with healing. Once the member feels that he or she is ready to become a Practitioner, they take a two week-long course. This course is referred to as “The Class.”  Once “The Class” is completed, the member is now a Practitioner and can begin to heal. The Practitioner uses the 700 page Science and Health text as well as Bible verses to discuss with people how to let God (aka “Mind” or “Spirit”) to be reflected accurately in their bodies. These Practitioners set their own fees and can provide services either in person or via the phone. <span id='here'><strong><mark> <---- Original Sentence was here ----> </mark></strong></span> The students spend their time analyzing texts, understanding how to explain health concerns from a religious standpoint and praying. “To the Christian Science healer, sickness is a dream from which the patient needs to be awakened. Disease should not appear real to the physician, since it is demonstrable that the way to cure the patient is to make disease unreal to him.” (Science and Health p. 417)Christian Science Nurses, do not go through training at all, and are merely members who help with physical concerns during the “Christian Science treatment.”  Barbara let me know that many nurses have taken “The Class” but they prefer to help other members in this path instead. All treatment that is provided by Christian Science Nurses is nonmedical in nature and includes care such as help with feeding, bathing, assistance with moving (i.e. from bed to chair).  Simple medical tasks such as blood pressure measuring, temperature taking, or applying cold/hot compresses are not included in their duties, and are expressly not permitted both by the church and by law.","This treatment is called “Christian Science treatment.”  Within “The Class”, the students do not learn about diseases or how to classify symptoms.","Please choose the Content fully preserved option","atten"
"207","The possibility that Internet users will be able to hide what they do from the ubiquitous ad tracking is a big win for consumers concerned with Internet privacy. Lawmakers have heralded the bill as a companion to the “Do Not Call” registry that was introduced in 2003. The registry prevented telemarketers from calling consumers who chose to opt-out from telemarketing calls. The “Do Not Track” bill would similarly force advertisers to respect the privacy of users who do not want their online activity to be subject to ad network tracking for marketing purposes. According to Rep. Jackie Speier (D-Hillsborough), the bill’s sponsor, “Consumers have a right to determine what if any of their information is shared with big corporations, and the federal government must have the authority and tools to enforce reasonable protections.” The “Do Not Track” bill would give the FTC eighteen months to come up with a set of enforceable privacy protection regulations for online ad network tracking. Some, like Ryan Calo, director of Stanford Law School’s Consumer Privacy Project, believe the bill does not go far enough. For one, he said, the bill only applied to those who chose to opt-out from ad network tracking. It does not affect those who do not know that they can or do not know how. This objection is partially overruled as the newest edition of the Firefox browser makes prevalent a “Do Not Track Me” option said to be the response to this and other similar bills. FBI Wants to Expand Internet WiretappingThe FBI, in an effort to keep up with the changing landscape of the Internet, is calling for a push to expand its capabilities in intercepting online evidence. <span id='here'><strong><mark> <---- Original Sentence was here ----> </mark></strong></span> According to Ms. Caproni, “In the ever-changing world of modern communications technologies, however, the FBI and other government agencies are facing a potentially widening gap between our legal authority to intercept electronic communications pursuant to court order and our practical ability to actually intercept those communications. As the gap between authority and capability widens, the government is increasingly unable to collect valuable evidence in cases ranging from child exploitation and pornography to organized crime and drug trafficking to terrorism and espionage.” The FBI argues that the current limitations on their wiretapping are antiquated. Many statutes have not been updated since the early nineties. Some of the statutes allow the FBI to read e-mail stored on a local server that is more than six months old. These laws date back to a time when users fetched their mail from a single computer almost daily, so e-mail that had been on a server for six months was considered abandoned. In the age of webmail, users keep most of their emails forever.","Citing advances in “webmail, social networking sites, and peer-to-peer services,” the FBI’s general counsel, Valerie Caproni, addressed Congress to discuss the increasing difficulty in tracing electronic communication in ongoing cases.","Citing advances in “webmail, social networking sites, and peer-to-peer services,” the FBI’s general counsel, Valerie Caproni, addressed Congress to discuss the increasing difficulty in tracing electronic coordination in extra cases.","mutX"
"35","In addition, According to N Hakamies, “Although material and human resources are significant constraints on agencies, the main challenge is to tackle ideological, managerial and policy barriers, and those related to donor influence.” Finding funding for family planning services continues to prove difficult for NGOs, and as a result they often do not exist or cannot meet the need levels of their constituencies. Reproductive Health funding problems underscore a larger issue with a reliance on NGO services, as can often be seen in IDP situations. The ability to provide services is often reliant on funding from outside sources and its continuation is based not on the needs of those being served, but on what they can find funding to provide. Often an organization's decision to cease operations in a country has more to do with a lack of financial support than the successful completion of their programming. There are certainly other issues with over reliance on NGO services, such as the fact that their services often don't solve the underlying infrastructure issues that will reemerge once the NGO presence is reduced. Many NGOs do not remain in-country for the post-conflict period. In effect, services are provided and once the initial emergency is over, the NGOs are gone and those still displaced must find a health provider somewhere else. This affects a country's capacity to rebuild post-conflict as well as their ability to provide services while the rebuilding effort is underway. Another issue is the added levels of coordination that occur when working with multiple aid groups to ensure healthcare service coverage. NGO involvement in IDP aid is a fact of life, however. <span id='here'><strong><mark> <---- Original Sentence was here ----> </mark></strong></span> Much of the focus on healthcare provision during emergency and conflict situations revolves around the use of Mobile Health Units (MHUs). Mobile Health Units are, at their most basic, mobile service units that usually provide specific forms of both preventative and curative care. They are generally expensive, however, and the fact that they only provide services intermittently tends to affect when they are appropriate for use. According to Stephane du Mortier and Rudi Coninx, “In situations of armed conflict, the range of PHC services that can be provided is severely restricted. This means that, in any given situation, it is essential to select the priority services among the spectrum of PHC services”. MHUs are limited in the number of services they can provide and the frequency at which they are available to any one community. These considerations must be kept in mind when formulating a plan as to how to use MHUs in any conflict or emergency setting. Du Mortier and Coninx describe their use of MHUs with the International Committee of the Red Cross during the conflict in Columbia in 2005. In this case, the rebel forces refused to allow access to the Ministry of Health in the country to citizens in areas they held.","The critical point is that the Ministry of Health must coordinate among those organizations.","its critical point is that the department of Health must coordinate among those organizations.","LSB"
"138","Students in a Kumon class will not run into a similar problem since these students are only allowed to advance once they meet a requirement of accuracy. <span id='here'><strong><mark> <---- Original Sentence was here ----> </mark></strong></span> The main website does not seem necessarily tailored to only Asian students (as is the case for juku schools). There are 6 listed Junior Kumon schools throughout Torrance and Gardena (including the surrounding areas of Carson, Rolling Hills, Manhattan and Redondo Beaches, Palos Verdes, and San Pedro) to which Gardena and Torrance residents can easily drive or bus. There are 5 Kumon schools for older children. In Japan, Juku is primarily an after school learning system that generally begins after the regular school day and ends at about dinner time nearly every weekday and at times during one or both weekend days depending on the juku campus. Japanese school systems consist of a grade 1-6 elementary system, 1-3 for junior high, and 1-3 for high school. Following junior high school education a Japanese student will take an entrance exam through which the scores determine the quality level of high school education and prestige of high school that the student will be accepted to attend. Upon completion of high school the student will take another entrance exam to enter a prestigious university such as the prized Tokyo University. The high school acceptance gives opportunities to be better prepared for the college entrance. And graduation from a prestigious university affects the access to jobs and other resources as well as social factors. In some more recent cases there are even competitive preschools and kindergartens that prepare students for competition of standardized testing and study habits. Because the Japanese school system in Japan is primarily driven by the ability to score high on standardized tests, students who come from Japan as well as their parents and family members who may move to an area like Torrance or Gardena, California, already have a background in how to accurately achieve high scores on standardized exams. This is one much overlooked reason as to why even international students are able to achieve high SAT scores and later MCAT, GRE, etc. scores. An article about juku in the US showed results that the amount of homework given to students who attended juku was completed about 80-90% compared to the amount of take home assignments that the student was required to turn in. When comparing American juku students (studying in US juku) with Japanese juku students (studying in Japanese juku) it was shown that overall the students in Japan still scored higher possibly due to attitudes of learning, social pressures, and academic relevance and realities of juku in US versus juku in Japan. Gains were greater for public school students who attended extracurricular activities. The schools from high SES background areas tended to show higher standardized testing scores. The author insists that improving scores in schools should start at home in which the parent or caretaker should provide opportunity, interest, and help for a student such as encouragement and strong involvement in academic performance.","There is also Kumon for preschoolers and kindergarten age students.","There is also Kumon for preschoolers and kindergarten age students.","Orig"
"164"," <span id='here'><strong><mark> <---- Original Sentence was here ----> </mark></strong></span> Surprisingly, however, they are still on track to meet 16 of the 19 Millennium Development Goals by 2015. While they are unlikely to meet the reproductive health targets, some of the goals Nepal is on track to meet include under-five and maternal mortality targets and disease-specific goals (halting the spread of HIV and malaria). The question is, how was Nepal able to meet these targets even when dealing with civil conflict and internally displaced people? Devotka and van Teijlingen identify multiple reasons why Nepal was successful even during such trying times. Some of the relevant items with regard to maintaining and strengthening health systems include:Neither side purposely disrupted health systems during the conflict. Though the conflict led to a decrease in service utilization, due to access problems, the rebels overall looked favorably on health services and made no efforts to deny access to citizens during the fighting. The rebels made an effort to ensure health clinics in their area were still sufficiently staffed and supplied. Most clinics in rebel-held areas were sufficiently staffed and had supplies. While many of the clinics were operated without trained health professionals, they still received regular training and supplies. Key actors increased coordination in response to the conflict, while maintaining a low profile. Regular meetings continued between the Ministry of Health (MOH) and community officials. In addition, the international organizations that responded by providing services kept a low profile. The one issue identified here, however, is the lack of clarity coming from the country level to all actors. While provisions were made for free care to poor citizens, criteria as to who qualified was not laid out to clinics. Similarly, communication between the MOH and international organizations was not identified as a strength of the program. Public health and more traditional service providers also increased their efforts during the conflict. In addition, community clinics were handed over to the communities to manage, as the federal government did not have adequate resources to manage them during the conflict. Programming for the elderly and indigent was increased, and many traditional female “attendants” saw their role increased. GDP in the country continued to rise during the extended conflict, and infrastructure improvements likely also contributed. These factors likely helped the country stay on track for the MDGs. The infrastructure improvements (roads and electricity) likely improved access for many citizens. There are clear lessons for developing a health systems strengthening approach in other conflict situations here. Namely, commitment from both sides of the conflict to not disrupting the health provision infrastructure in the country is key. Ensuring clinics still run and funds are in place can help to minimize the effects of access and migration. In addition, the government must be able to hand off some of the management to provincial or community levels, especially in rebel-held zones where they have limited access. So what are the takeaways from the Nepal case study?","Nepal was embroiled in a bloody civil war from 1996 until 2006.","Nepal was embroiled in a bloody civil war from 1996 until 2006.","Orig"
"211","Throughout the time she was writing the text, she was healing sickness and teaching others how to heal through her method. Originally, she wanted healers to stay within their own Christian denominations and heal sickness with her method. But, she discovered that her ideas and healing methods were modified too radically by others and she felt that it was important to consolidate into one group and by 1879 she founded this church and a teaching college that was chartered in the State of Massachusetts. One interesting note, there is no established clergy, but rather members who take turns presenting and overseeing events. The Christian Science Church is well known for their reading rooms. These rooms are open to the public and house scriptural references, Christian Science Journals and magazines as well as Bibles and other study materials. One Saturday, I met with Barbara H. at the Christian Science Reading Room at 10 West 68th Street in Manhattan. The interior had two levels, the street level being where the church was located and the lower level housing the reading room. Immediately it reminded me of all churches – dark lighting, the smell of old books, wood and brass fixtures, and religious pastoral scene prints and sayings in frames on the walls. For some reason, I had envisioned it in my mind as more modern and less like the Lutheran Church I had gone to in Ohio in my youth. Barbara asked me questions at first and when she found out I was studying science at school, she asked me if I had seen the movie “What the Bleep do we Know.”  She also brought up how in Physics, especially in Quantum Physics, scientists are beginning to question what matter is and the scientist’s role when dealing with this concept. We began to discuss what matter was in terms of Christian Science practice. According to Christian Science, matter is not real. The only thing that is real is God. God is also referred to as “Mind” or “Spirit.”  Matter therefore is a reflection. <span id='here'><strong><mark> <---- Original Sentence was here ----> </mark></strong></span> Since God is perfect, this reflection, which is matter, has to be perfect. If matter is not perfect, it is a human’s mind (not to be confused with “Mind” which is God,) which is incorrectly perceiving this reflection. To be healed of disease, first a person must believe that matter is not real and therefore diseases do not exist. In a sense, they are a figment of a person’s imagination. “Maintain the facts of Christian Science, - that Spirit is God, and therefore cannot be sick; that what is termed matter cannot be sick; that all causation is Mind, acting through spiritual law.” (Science and Health p. 417)Since some diseases could be viewed as psychosomatic or a chemical imbalance, I wanted a question about an ailment that would be one or the other. I asked Barbara about broken bones.","What matter is a reflection of is, is God.","What matter is a reflection of is, is God.","Orig"
