qid,passage,original,anon_sent,tech
"77","Briefly, the other options you have to further limit what people see about you include disabling Connections Browse, which keeps your connections private, Profile Views, which limits what information people who you have browsed can see, opting out of the Service Provider Directory and the LinkedIn Partner Advertising directory. These settings will limit the number of eyes on your profile but will not limit your ability to use your LinkedIn profile as a resume. You can also use this page to control the unsolicited e-mail you receive by modifying the settings on the Receiving Messages settings page as well as the InMails page. MyID Can Protect Your Privacy Settings and Alert You If They ChangeThe MyID suite of privacy applications can protect your privacy as it monitors dozens of social network privacy settings. MyID can change privacy settings to a more secure setting and help you understand what information is private and public. <span id='here'><strong><mark> <---- Original Sentence was here ----> </mark></strong></span> If you’d like to make your whole blog private, head to Settings and then Privacy and check the radio button for I would like my blog to be visible only to users I choose. Click Save Changes, and then you can start to add users by their Wordpress username. The Word Press Blog Visibility settings have three options which will allow you to set the level of privacy of your blog. The default setting allows everyone, including search engines, to access your blog. The second, more limited, setting blocks search engines from crawling your blog, requiring users to type in your URL directly. Depending on how much personal information you post on your blog, you can choose to change privacy settings to a high level in order to protect your privacy. If you’d like to make a particular post private so that only you or a bunch of people you choose can see it, all you need to do is head to the post editor and click on Visibility in the Publish pane. You can choose to make the post either password protected, in which case you’ll need to supply a password, or private, which means only that you or other blog contributors will be able to see it. Click OK and that will be made effective immediately. By changing privacy settings of your WordPress blog, you can protect your privacy and be sure that only approved users read your content. Maximize Privacy on Social Networks with MyID Any time you post private information to WordPress, MyID will find it and alert you, allowing you to remove it before any search engine has a chance to archive it, maximizing your privacy on social networks. Without resorting to Hollywood stereotypes about hackers, let’s take a look at the demographics, psychology, and goals of your average online computer hacker. The vast majority of hackers are from China or Russia. These nations serve as a breeding ground for criminals of every kind, not just computer criminals.","Protect personal information with the MyID identity theft monitoring solution.","Protect personal info with the MyID identity theft monitoring solution.","mutX"
"64","Those two amendments would be the most crucial in preventing lack of maintenance by homeowners, but as a last resort for extreme circumstances, the preservation Commission or the Department of Inspections should be given the power to seek judicial enforcement against any homeowner found to be demolishing their home through neglect. If these amendments were passed by the Metro Counsel, then the Preservation Commission and the Department of Inspections would have a lot more power to take preemptive action against demolition by neglect. <span id='here'><strong><mark> <---- Original Sentence was here ----> </mark></strong></span> For this problem to be fully confronted, the government along with Preservation groups should work together to make funds available for homeowners who are legitimately having difficulty in maintaining the integrity of their historical property. This system of government enforcement with outside organizations working with and providing resources for the average homeowner, and penalizing those who are purposefully trying to circumvent the law, will not only avoid costly and embarrassing court battles, but will better ensure that the cultural and historical properties that define Louisville will be preserved for future generations of citizens. I dissent from the majority’s holding that a rational-basis review of Congress’ decision to regulate a “class of activities” that includes local, non-commercial behavior is proper, as long as the regulation is part of a “general regulatory statute [that] bears a substantial relation to commerce,” while also refusing to hear as-applied challenges that would “excise individual applications of a concededly valid statutory scheme,” which effectively abolishes any meaningful limitations on Congress’ power to regulate under the Commerce Clause. Instead, I would have held the CSA unconstitutional as applied to respondent Monson who cultivated and consumed medical marijuana which never entered the stream of commerce, is not a regulation that is rationally related to Congress’ Commerce Clause power, while remanding the question of the constitutionality of regulating Raich’s medical marijuana use, in accordance with the stricter scrutiny test described in this opinion. The respondents have argued that application of the CSA to their “intrastate, noncommercial cultivation and possession of cannabis for personal medical purposes as recommended by a patient's physician pursuant to valid California state law” is an unconstitutional exercise of Congress’ power under the Commerce Clause. I agree with Justice Scalia in his concurrence, that a necessary and proper clause analysis is necessary because the respondents are challenging the authority of Congress’ implied power to regulate this class of activities, but disagree with his conclusion that regulations of respondent’s activities were “appropriate means of achieving the legitimate end of eradicating Schedule I substances from interstate commerce.” In conducting the necessary and proper clause analysis, I think it is necessary to differentiate between the respondents, since Raich obtained her marijuana from a third-party, while Monson’s production and consumption was entirely personal.","Of course we could not rely on the government alone to prevent this problem, much of what underlines the issue is economic difficulties and public perception that Preservation groups only seek to hinder development.","Of course, we cannot trust the government alone to avoid this problem, many of what the problem emphasizes are economic difficulties and the public perception that conservation groups are just trying to prevent development.","BT"
"q_5","The possibility that Internet users will be able to hide what they do from the ubiquitous ad tracking is a big win for consumers concerned with Internet privacy. Lawmakers have heralded the bill as a companion to the “Do Not Call” registry that was introduced in 2003. The registry prevented telemarketers from calling consumers who chose to opt-out from telemarketing calls. The “Do Not Track” bill would similarly force advertisers to respect the privacy of users who do not want their online activity to be subject to ad network tracking for marketing purposes. According to Rep. Jackie Speier (D-Hillsborough), the bill’s sponsor, “Consumers have a right to determine what if any of their information is shared with big corporations, and the federal government must have the authority and tools to enforce reasonable protections.” The “Do Not Track” bill would give the FTC eighteen months to come up with a set of enforceable privacy protection regulations for online ad network tracking. Some, like Ryan Calo, director of Stanford Law School’s Consumer Privacy Project, believe the bill does not go far enough. For one, he said, the bill only applied to those who chose to opt-out from ad network tracking. It does not affect those who do not know that they can or do not know how. This objection is partially overruled as the newest edition of the Firefox browser makes prevalent a “Do Not Track Me” option said to be the response to this and other similar bills. FBI Wants to Expand Internet WiretappingThe FBI, in an effort to keep up with the changing landscape of the Internet, is calling for a push to expand its capabilities in intercepting online evidence. Citing advances in “webmail, social networking sites, and peer-to-peer services,” the FBI’s general counsel, Valerie Caproni, addressed Congress to discuss the increasing difficulty in tracing electronic communication in ongoing cases. <span id='here'><strong><mark> <---- Original Sentence was here ----> </mark></strong></span> As the gap between authority and capability widens, the government is increasingly unable to collect valuable evidence in cases ranging from child exploitation and pornography to organized crime and drug trafficking to terrorism and espionage.” The FBI argues that the current limitations on their wiretapping are antiquated. Many statutes have not been updated since the early nineties. Some of the statutes allow the FBI to read e-mail stored on a local server that is more than six months old. These laws date back to a time when users fetched their mail from a single computer almost daily, so e-mail that had been on a server for six months was considered abandoned. In the age of webmail, users keep most of their emails forever.","According to Ms. Caproni, “In the ever-changing world of modern communications technologies, however, the FBI and other government agencies are facing a potentially widening gap between our legal authority to intercept electronic communications pursuant to court order and our practical ability to actually intercept those communications.","In addition, the international organizations that responded by providing services kept a low profile.","atten"
"49","Students in a Kumon class will not run into a similar problem since these students are only allowed to advance once they meet a requirement of accuracy. There is also Kumon for preschoolers and kindergarten age students. The main website does not seem necessarily tailored to only Asian students (as is the case for juku schools). There are 6 listed Junior Kumon schools throughout Torrance and Gardena (including the surrounding areas of Carson, Rolling Hills, Manhattan and Redondo Beaches, Palos Verdes, and San Pedro) to which Gardena and Torrance residents can easily drive or bus. <span id='here'><strong><mark> <---- Original Sentence was here ----> </mark></strong></span> In Japan, Juku is primarily an after school learning system that generally begins after the regular school day and ends at about dinner time nearly every weekday and at times during one or both weekend days depending on the juku campus. Japanese school systems consist of a grade 1-6 elementary system, 1-3 for junior high, and 1-3 for high school. Following junior high school education a Japanese student will take an entrance exam through which the scores determine the quality level of high school education and prestige of high school that the student will be accepted to attend. Upon completion of high school the student will take another entrance exam to enter a prestigious university such as the prized Tokyo University. The high school acceptance gives opportunities to be better prepared for the college entrance. And graduation from a prestigious university affects the access to jobs and other resources as well as social factors. In some more recent cases there are even competitive preschools and kindergartens that prepare students for competition of standardized testing and study habits. Because the Japanese school system in Japan is primarily driven by the ability to score high on standardized tests, students who come from Japan as well as their parents and family members who may move to an area like Torrance or Gardena, California, already have a background in how to accurately achieve high scores on standardized exams. This is one much overlooked reason as to why even international students are able to achieve high SAT scores and later MCAT, GRE, etc. scores. An article about juku in the US showed results that the amount of homework given to students who attended juku was completed about 80-90% compared to the amount of take home assignments that the student was required to turn in. When comparing American juku students (studying in US juku) with Japanese juku students (studying in Japanese juku) it was shown that overall the students in Japan still scored higher possibly due to attitudes of learning, social pressures, and academic relevance and realities of juku in US versus juku in Japan. Gains were greater for public school students who attended extracurricular activities. The schools from high SES background areas tended to show higher standardized testing scores. The author insists that improving scores in schools should start at home in which the parent or caretaker should provide opportunity, interest, and help for a student such as encouragement and strong involvement in academic performance.","There are 5 Kumon schools for older children.","There are 5 Kumon schools for older children.","Orig"
"188","Briefly, the other options you have to further limit what people see about you include disabling Connections Browse, which keeps your connections private, Profile Views, which limits what information people who you have browsed can see, opting out of the Service Provider Directory and the LinkedIn Partner Advertising directory. These settings will limit the number of eyes on your profile but will not limit your ability to use your LinkedIn profile as a resume. You can also use this page to control the unsolicited e-mail you receive by modifying the settings on the Receiving Messages settings page as well as the InMails page. MyID Can Protect Your Privacy Settings and Alert You If They ChangeThe MyID suite of privacy applications can protect your privacy as it monitors dozens of social network privacy settings. MyID can change privacy settings to a more secure setting and help you understand what information is private and public. Protect personal information with the MyID identity theft monitoring solution. <span id='here'><strong><mark> <---- Original Sentence was here ----> </mark></strong></span> Click Save Changes, and then you can start to add users by their Wordpress username. The Word Press Blog Visibility settings have three options which will allow you to set the level of privacy of your blog. The default setting allows everyone, including search engines, to access your blog. The second, more limited, setting blocks search engines from crawling your blog, requiring users to type in your URL directly. Depending on how much personal information you post on your blog, you can choose to change privacy settings to a high level in order to protect your privacy. If you’d like to make a particular post private so that only you or a bunch of people you choose can see it, all you need to do is head to the post editor and click on Visibility in the Publish pane. You can choose to make the post either password protected, in which case you’ll need to supply a password, or private, which means only that you or other blog contributors will be able to see it. Click OK and that will be made effective immediately. By changing privacy settings of your WordPress blog, you can protect your privacy and be sure that only approved users read your content. Maximize Privacy on Social Networks with MyID Any time you post private information to WordPress, MyID will find it and alert you, allowing you to remove it before any search engine has a chance to archive it, maximizing your privacy on social networks. Without resorting to Hollywood stereotypes about hackers, let’s take a look at the demographics, psychology, and goals of your average online computer hacker. The vast majority of hackers are from China or Russia. These nations serve as a breeding ground for criminals of every kind, not just computer criminals.","If you’d like to make your whole blog private, head to Settings and then Privacy and check the radio button for I would like my blog to be visible only to users I choose.","If you’d like to make you nature blog private, head to Settings and then Privacy and ascertain the radio button for I must kind my blog to be visible only to users I choose.","mutX"
"169","In comparison to American schools such as those in Los Angeles County, there are schools such as preparatory and some private schools that prepare students early on for SAT. And even fewer public school systems allow for classes and tutoring that is written into the curriculum or that is at the very least affordable for working students of parents. SAT courses such as Kaplan and Princeton Review, while popular, are extremely expensive such as $1000 for average cheap courses. These classes tend to be attended by sophomores, juniors, and senior high school students. In comparison to the juku cram schools in Japan which would be attended from about age 13 during junior high or even earlier and throughout high school. Another important comparison is knowledge of and access to such schools. In Japan, the juku crams schools are expensive. Some schools rate very high for acceptance to top high schools and top universities, while others rate lower on the scale. But nonetheless, the students learn from such schools about standardized testing very early on. The affordability of these schools varies. And juku schools are more of a common knowledge for parents. If a parent in Japan cannot afford or decides not to send their own child to juku, it is likely that the student will know at least some other friends that do attend juku or will at least be given other means through knowledge of the parent to pass exams early on (such as providing textbooks or a private tutor). Juku allows for dangerous competition between students in the face of college entrance. Rohlen mentions that such competition even leads to student suicide at times. Juku systems began as a means of increasing public school comparisons to private schools. The study of juku school systems was recently studied by scholars in the 1980s. The juku focus is on primarily one subject area such as history, language, or science, or math. The school will not focus on details or information such as what may be found outside of the entrance exams. Juku also differ from one another, such as the shingaku juku, where the top students attend, or hoshu juku where the students use the juku school to catch up if they are behind other students in their regular school evaluations. In LA County prep schools for American standardized testing are not always readily available. They are extremely expensive, and the student may even begin to start the classes much too late to learn the material for an exam such as the SAT adequately. In many instances students and parents alike are not taught much about how important the SAT exam is. Because the school system is different in Japan in comparison to the USA, the standardized testing preparation follows that pattern. <span id='here'><strong><mark> <---- Original Sentence was here ----> </mark></strong></span> In the US a student can do poorly on the SAT and still go to a community college and then graduate from a UC and possibly be admitted to a prestigious university afterwards for a Masters or PhD degree.","In Japan standardized testing really drives many important aspects of a student’s future.","In Japan standardized testing really drives all important aspects of a nation ’s future.","LSB"
"129","Briefly, the other options you have to further limit what people see about you include disabling Connections Browse, which keeps your connections private, Profile Views, which limits what information people who you have browsed can see, opting out of the Service Provider Directory and the LinkedIn Partner Advertising directory. <span id='here'><strong><mark> <---- Original Sentence was here ----> </mark></strong></span> You can also use this page to control the unsolicited e-mail you receive by modifying the settings on the Receiving Messages settings page as well as the InMails page. MyID Can Protect Your Privacy Settings and Alert You If They ChangeThe MyID suite of privacy applications can protect your privacy as it monitors dozens of social network privacy settings. MyID can change privacy settings to a more secure setting and help you understand what information is private and public. Protect personal information with the MyID identity theft monitoring solution. If you’d like to make your whole blog private, head to Settings and then Privacy and check the radio button for I would like my blog to be visible only to users I choose. Click Save Changes, and then you can start to add users by their Wordpress username. The Word Press Blog Visibility settings have three options which will allow you to set the level of privacy of your blog. The default setting allows everyone, including search engines, to access your blog. The second, more limited, setting blocks search engines from crawling your blog, requiring users to type in your URL directly. Depending on how much personal information you post on your blog, you can choose to change privacy settings to a high level in order to protect your privacy. If you’d like to make a particular post private so that only you or a bunch of people you choose can see it, all you need to do is head to the post editor and click on Visibility in the Publish pane. You can choose to make the post either password protected, in which case you’ll need to supply a password, or private, which means only that you or other blog contributors will be able to see it. Click OK and that will be made effective immediately. By changing privacy settings of your WordPress blog, you can protect your privacy and be sure that only approved users read your content. Maximize Privacy on Social Networks with MyID Any time you post private information to WordPress, MyID will find it and alert you, allowing you to remove it before any search engine has a chance to archive it, maximizing your privacy on social networks. Without resorting to Hollywood stereotypes about hackers, let’s take a look at the demographics, psychology, and goals of your average online computer hacker. The vast majority of hackers are from China or Russia. These nations serve as a breeding ground for criminals of every kind, not just computer criminals.","These settings will limit the number of eyes on your profile but will not limit your ability to use your LinkedIn profile as a resume.","These settings will limit the number of eyes on you profile but will not limit your ability to use your LinkedIn profile as a resume.","mutX"
